N,Post,Label..Yim,Subreddit,Keyword,Date_UTC,Title,Date,Label...Dev,Label...Joseph,Label...Xiaobing
0,"I have two accounts, one where I mainly post and one where I only post the reels that I made. Now I was offline for 6 months and only recently started posting again. Before I always got about 500 to 1k likes on my posts on my main account (2.3k), and my reels got about 3k views, which is just right imo. But now I get 10 views on my reels, 20 likes on my posts even though my follower count did not decrease significantly. People that I was close with online didn't even notice that I was back. 

The other reel dumpster I made has 90 followers, but the reels there get over 3k views. 

I'm just genuinely confused.",,Instagram,"""Instagram's algorithm""",1640449439,Can smb explain Instagram's algorithm to me?,2021-12-25 16:23:59,,,
8,"Ever since I opened up an art instagram account, I felt this unnecessary pressure about keeping a consistent art style and many things about instagram algorithm bothered me so much. The fact people I know irl including my mom’s boss following me was bothering me as well so I really hated it when they liked and commented under my posts. I’m a designer and drawing is what I do at work, coming at home late at night and draw for another 2-4 hours for the gram was really hard too. Sure, I love drawing and that’s why I became a designer but sometimes I just want to sit down relax and not do art related things. I have successful art related career so it’s not like felt the need of getting lots of followers or commissions but social media monster still managed to get under my skin.",,ArtistLounge,"""instagram algorithm""",1640289209,I deleted my instagram account and it was the best thing I ever did,2021-12-23 19:53:29,,,
13,"What determines the pictures that come up on your discovery feed when they involve mutuals? 

I’ve noticed specific profiles popping up on my discovery page linked to mutuals and I was wondering if there was a reason why those particular ones pop up.",,Instagram,"""instagram algorithm""",1640048009,Question about Instagram algorithm,2021-12-21 0:53:29,,,
1,"I started an IG account 4 months ago for my brand and posted 9 posts but I haven’t been active since then. I’ve got about 150 followers on there which I got from follow for follow and organic.

Have I ruined my chances of getting boosted by the IG algorithm?

Should I start a new IG account for the brand?",problem,InstagramMarketing,"""ig algorithm""",1639663929,Should I create a new account?📈,2021-12-16 14:12:09,problem,"sensemaking, problem ",problem
18,"indeed i dont have a problem with sharing my password with known apps. but  since instagram algorithm directly taking down the account when i log-in, i need to find a app or website that just shows me who unfollowed me. I can manually unfollow them on instagram, thats not a problem for me. but i dont want to waste my time with finding ""who"" unfollowed me.

Thanks",,Instagram,"""instagram algorithm""",1639344243,View unfollowers without login,2021-12-12 21:24:03,,,
22,[removed],,Instagram,"""instagram algorithm""",1638852311,I don’t understand Instagram algorithm.,2021-12-07 4:45:11,,,
24,"The engagement levels that your content generates indicates to the Instagram algorithm the potential “demand” level for the content. Unlike the Google search engine where the demand is simply the number of searches, on Instagram and other social media platforms where the content finds the users the algorithm must predict what people will want to see.

﻿﻿“We make a set of predictions. These are educated guesses at how likely you are to interact with a post in different ways. There are roughly a dozen of these. In Feed, the five interactions we look at most closely are how likely you are to spend a few seconds on a post, comment on it, like it, save it, and tap on the profile photo. The more likely you are to take an action, and the more heavily we weigh that action, the higher up you’ll see the post.”

﻿﻿From the [post](https://about.instagram.com/blog/announcements/shedding-more-light-on-how-instagram-works) “Shedding More Light on How Instagram Works” (A. Mosseri)

﻿I find the approach of predicting demand very sophisticated and even a bit controversial. We’re in the 21st century and technology seems to predict what we want to see before we even know it.﻿﻿

**What do you think about it?**

(The text, by the way, is quoted from [this article](https://viralspy.io/blog/instagram-organic-growth-strategy/) on social media growth strategy)",sensemaking,InstagramMarketing,"""instagram algorithm""",1638362782,Crazy. They know what you want even before you know it yourself.,2021-12-01 12:46:22,sensemaking,problem ,sensemaking
26,"A problem I have since some months ago its the Instagram algorithm, the recommended post are divided in: Content I enjoy, liked and saved before and content I never consume, never liked or saved and told Instagran more 100 goddam times in not interest into.",problem,Instagram,"""instagram algorithm""",1637971098,It's just me or Instagram algorithm is broken?,2021-11-26 23:58:18,problem,problem,problem
28,[removed],,Instagram,"""instagram algorithm""",1637839872,TikTok vs Instagram algorithm. Is insta even worth it anymore?,2021-11-25 11:31:12,,,
0,"i've recently created a fan-based account for a youtube celebrity chef. I took an udemy course and learned most of my IG marketing knowledge there. One of the thing that mentioned in the course is to post regularly so that IG algo can trust that you are reliable in terms of posting. My account is picking up much slower than I expected after 30 posts for the past two weeks. I am looking for 2-3 people as my IG support group buddies. The idea is for us to form a private group where we can support and supervise each other to not give up during initial process. The group will also serve as ""advisors"" where we can tell each other what we think of the post/content.  One problem I am facing simply is that I have no idea why nobody likes my content. I thought they are perfect. Hearing someone objective opinions is super helpful. 

Leave a comment if you are interested! I am currently doing it with another redditor to help each other out but wanna add maybe like 2-3 more people.",,InstagramMarketing,"""IG algo""",1637637740,"Looking for ""IG buddies""",2021-11-23 3:22:20,,,
40,"Hi everyone, I have had my Instagram account for about a year now and it was created during the early pandemic. I travel very often and I want to show others part of the world that they are missing and also advice and show them how to navigate new places. I am having a tough time getting people to see the content I am creating which I put a lot of work into because my account is small and it is difficult when Instagram algorithm only pushes larger accounts according to those who have had Instagram for longer. How else can I grow my account to a point where I can monetize and build a real business from it without getting lost in the algorithm or how often should i post?[My IG account](www.instagram.com/coitraveler)",,Instagram,"""instagram algorithm""",1637122078,Had IG for a year and I am trying to grow &amp; build a travel business,2021-11-17 4:07:58,,,
41,"My account got banned because of this.

Black women: calls me a colonizer and some other slurs and tells me to stay away from africa, and if i go there i should get shot

Instagram: **calm**

Me: calls her a b!tch and the black people on the comment section dont claim her

Instagram: **PANICC**

Oh ya, and my story got taken down for posting about a toy ak47

And oh boy, i just wanted some gaming content on the gaming tag on the explore page, and instead i found pictures of half naked girls, and i saw one with her tits slightly exposed. And i made it clear that i am under 18

I think they should improve the algorithm a bit, i hope they already did, because i haven't been on Instagram for like 4 months",,Instagram,"""instagram algorithm""",1637114756,The instagram algorithm is very wacky and unpredictable,2021-11-17 2:05:56,,,
45,"Hello Guys,

I am an expert in Instagram growth and managing. I have been doing this for almost 6 years and managed/grew over 300 pages for myself and for my clients. If you want me to manage and grow your companys or your personal or your niche page, just let me know. Its affordable or if you tell me your budget, I can also make an affordable plan for you. My plan is pretty simple yet powerful. I have grown so many pages for myself and for my clients, so now it's safe to say, I know the majority of the Instagrams ins and outs and have good knowledge about Instagram algorithm.

Pricing: $150-$300/Month depending on the niche and the workload.

DM me for further information, if you are interested. Thanks!!",ad,InstagramMarketing,"""instagram algorithm""",1636456641,I Will Help You Manage &amp; Grow Your Instagram Account.,2021-11-09 11:17:21,ads,ads ,ads
57,"I own a page, almost close to 10k, used to always get hundreds of likes per post.. until yesterday. All my recent posts got less than 50 likes in around several hours of being on, when i would make 10 times more in that amount of time.

I recently underwent a strong wave of likes on some of my reels, which gained me lots of views and followers, but that is common with meme pages right? No shadowban, no posts removed lately so it doesn’t explain. 

I get lots of interactions per day by my followers alone so this doesn’t explain the sudden incredible drop on likes and views, even my stories aren’t getting anymore views.

Anyone knows why insta would be messing around? Has this ever happened or is it happening to someone else too?",,Instagram,"""instagram algorithm""",1635668174,Is the instagram algorithm broken?,2021-10-31 8:16:14,,,
58,[removed],,socialmedia,"""instagram algorithm""",1635625013,Instagram algorithm help,2021-10-30 20:16:53,,,
10,,,Instagram,"""ig algorithm""",1635397840,"New IG algorithm is insane, more impressions from HOME than EXPLORE",2021-10-28 5:10:40,,,
3,"For the past two or three weeks I see some posts come up on top of my feed or one beneath for 2 or 3 days. It's honestly driving me nuts, because I miss out on stuff my friends (the ones I actually care about) post on their feed.

What happened to the algorithm lately, it seems like it's getting worse by day. Anyone else seems this very annoying?",problem,Instagram,"""Instagram's algorithm""",1635252572,"Some posts stay on top of my feed for 2 or 3 days, what's wrong with Instagram's algorithm?",2021-10-26 12:49:32,probelm,problem,problem
62,,,Instagram,"""instagram algorithm""",1634995996,Instagram algorithm is a joke. They deleted this comment and I requested review. It’s been a month but still in review. Since then my posts not showing up on explore,2021-10-23 13:33:16,,,
11,"Greetings! 

A post of mine from 2 weeks ago is currently gaining a lot of attention, through people's ""explore"" sections. 
If I make another new post now, will that make the IG algorithm mark the viral post as ""old""  and shelve it away, prematurely cut off the attention it's getting? Should I wait for the viral post to ""die down"" first before making another post?

Thank you!",,Instagram,"""ig algorithm""",1634692254,My post has gone viral. Should I wait before posting again?,2021-10-20 1:10:54,,,
67,"Hi, so I typically have memes and other posts on my Instagram explore page, but a few hours ago, it became filled with One Direction and Grey's Anatomy posts. I have never liked or viewed any posts relating to both and I'm confused. Is this an instagram issue?",,Instagram,"""instagram algorithm""",1634280191,Instagram Algorithm problem,2021-10-15 6:43:11,,,
69,"I’ve noticed a few things, in my experience:

-if you post more then a couple story posts, the reach goes down (for the most part)

-posting a story at the same time every day doesnt give you a good reach

-Instagram doesn’t like when you post once a week, the more you post the better reach

-the algorithm prefers a photo of your face over a no-human photo (for the most part)


What have *you* noticed?",sensemaking,Instagram,"""instagram algorithm""",1634226432,What have YOU noticed is good for the Instagram algorithm?,2021-10-14 15:47:12,sensemaking,sensemaking,sensemaking
72,[removed],,socialmedia,"""instagram algorithm""",1634044197,How the Instagram algorithm works in 2021 (and can you beat it?),2021-10-12 13:09:57,,,
73,[removed],,socialmedia,"""instagram algorithm""",1634044088,How the Instagram algorithm works in 2021 (and can you beat it?),2021-10-12 13:08:08,,,
74,[removed],,socialmedia,"""instagram algorithm""",1634044005,How the Instagram algorithm works in 2021 (and can you beat it?),2021-10-12 13:06:45,,,
75,"I saw someone else post about this recently so I know it affects more people. I've had my instagram since about 2014 and I've never received any warnings or anything. I literally only post nature photos and photos of my cats plus an occasional selfie. I have just under 1000 followers and I used to get 100+ likes on everything, but for the last couple months I'm lucky to get 20 likes. It really doesn't make sense. Is this a form of shadow banning? Is there any way to get the instagram algorithm to stop hiding my posts?",problem,Instagram,"""instagram algorithm""",1634030898,Instagram Shadow Ban Bad,2021-10-12 9:28:18,problem,"sensemaking, problem ",problem
78,"Since instagram came back on, has anyone had drastic changes in engagement? seems like it took a deep dive for me.",problem,Instagram,"""instagram algorithm""",1633450138,Instagram algorithm change since blackout,2021-10-05 16:08:58,problem,problem,problem
81,[removed],,socialmedia,"""instagram algorithm""",1633358466,How the Instagram algorithm works in 2021,2021-10-04 14:41:06,,,
82,[removed],,SocialMediaMarketing,"""instagram algorithm""",1633358360,How the Instagram algorithm works in 2021,2021-10-04 14:39:20,,,
12,"Hi. About five years ago, I had a stupid idea to get fake IG followers via an app (which does not exist anymore). Over the past years, after realizing this was stupid, I deleted and blocked most of them. Is the account damaged forever (i.e. permanently changed IG algorithm of showing my posts due to low engagement in the past), or will it be ok as any other account?

I'm deciding whether to create a new account for my self-employed business or to keep just one. So this would partly help me to make a decision.

Thanks in advance :)",,Instagram,"""ig algorithm""",1633252490,Fake followers - is account damaged forever?,2021-10-03 9:14:50,,,
85,[removed],,SocialMediaMarketing,"""instagram algorithm""",1633013772,How the Instagram algorithm works in 2021,2021-09-30 14:56:12,,,
86,[removed],,socialmedia,"""instagram algorithm""",1633013637,How the Instagram algorithm works in 2021,2021-09-30 14:53:57,,,
6,"So I've been running a mental health Instagram for quite some time now and in 2018-2019, that's when I had the best growth. I don't really know what I did back then to make it so good...I think that I regularly posted, engaged with like-minded accounts, and made sure to like respond to my followers. But 3 years has passed and Instagram's algorithm changed so much and I went through a period of extreme burnout and completely stopped posting on the account. So obviously, I lost a shit ton of followers. Now I finally started posting again and well I keep losing followers. My engagement sucks and I have a following of around 42.4 K and only get like a max of 100 likes. So its pretty bad. I'm feeling pretty discouraged, but I also really love the work that I'm doing, the problem is that Instagram just changed so dramatically since I started the account. I don't even know how to boost a following anymore. Back then, it seemed so easy.",problem,InstagramMarketing,"""Instagram's algorithm""",1632796532,I killed my Instagram account...how to recover?,2021-09-28 2:35:32,problem,"problem, sensemaking",problem
91,[removed],,socialmedia,"""instagram algorithm""",1632790929,Instagram Algorithm News,2021-09-28 1:02:09,,,
96,"A new social space is here. If you're fed up of Instagram algorithm, try uhive. The beta version is available in the appstore now, and the first 100k users get a special badge for joining.
Also, you get paid to use the app. The more you use it, the more you're paid.
You can use this invite code to get 200 free uhive tokens on sign up - J50YL8
And this code is to view my space on uhive, if you're interested in travel photography - TTTJXBQ

Also, for anyone in China, this app hasn't been blocked by the great firewall.... Yet.

[here you can read up a bit more about uhive](https://read.cash/@warliezdiaz/uhive-a-value-based-and-user-centered-social-network-d10cbccc)",ad,InstagramMarketing,"""instagram algorithm""",1631886963,The new Instagram?,2021-09-17 13:56:03,ads,ads ,ads.
97,"This damn Instagram algorithm has been IMPOSSIBLE to keep up with, especially for my business pages. What're you doing to stay on top of it? It feels like we go through week-long waves of mastering it and get a ton of engagement, then we hit rock bottom again the next week and don't even get 100 likes or a single comment. HELP!!!!!!",problem,Instagram,"""instagram algorithm""",1631820283,Business Accts - how are you staying relevant?,2021-09-16 19:24:43,problem,problem,problem
15,,,Instagram,"""ig algorithm""",1631760852,Can someone pls explain why the IG algorithm is giving me the shaft?,2021-09-16 2:54:12,,,
7,"Have you all noticed that the  IG algorithm is not getting any better?   No matter how much advices you get from social media ""experts,""   it does not matter to the algorithm. My posts keep being unreachable to  most of my followers and non-followers.   Even my Stories do not get a lot of views but it sure is gaining bots.      When it comes to Reels,  I would get  reactions every now or then from non-followers but mostly reactions from few of my followers.   I don't know what Mark Zuckerberg and Adam Massori are fooling with.   If this algorithm gets any worse, it would hurt upcoming talented people who want to be seen and small businesses will lose money.  As a result, more people will wake up and leave Instagram.",problem,Instagram,"""Instagram's algorithm""",1631200914,Concerning About Instagram's Algorithm,2021-09-09 15:21:54,problem,problem,problem
16,"Have you all noticed that the  IG algorithm is not getting any better?   No matter how much advices you get from social media ""experts,""   it does not matter to the algorithm. My posts keep being unreachable to  most of my followers and non-followers.   Even my Stories do not get a lot of views but it sure is gaining bots.      When it comes to Reels,  I would get  reactions every now or then from non-followers but mostly reactions from few of my followers.   I don't know what Mark Zuckerberg and Adam Massori are fooling with.   If this algorithm gets any worse, it would hurt upcoming talented people who want to be seen and small businesses will lose money.  As a result, more people will wake up and leave Instagram.",problem,Instagram,"""ig algorithm""",1631200914,Concerning About Instagram's Algorithm,2021-09-09 15:21:54,problem,"problem, sensemaking ",problem
105,,,Instagram,"""instagram algorithm""",1630423754,"Okay so idk how instagram algorithm really works, and i guess it changes all the time. Im just confused that my engagement goes into negatives if i don’t post every 2 days, it acts like i have some momentum but if i stop it just drops. Then mutals of mine will post way less often and just be fine :/",2021-08-31 15:29:14,,,
106,"I think I should not creating art in the first place

I have no growth of audience, despite spending my own hard earn salary for straight two years to pursue this craft, 

I don't want to stop for I came this far, but It's a painful truth to know that so far that I invested for literally Nothing, 

yes, its a passion, whats the point of wasting days or weeks for work that no one ever saw or care

I want to blame the Instagram algorithm, but it seems that I started to blame myself, my taste, and the disconnection of my work at art against the market

Instagram just scream that You should not start art unless you paint pinterest girls, good luck penetrating that 1 M follower if you paint other stuff",,ArtistLounge,"""instagram algorithm""",1630388155,"I'm losing motivation, I think I took the wrong path on this craft",2021-08-31 5:35:55,,,
18,"Does anybody else find that only every other reel is pushed out to non-followers?

I’ve noticed this pattern has been happening with my account for about the last month now and I’m pretty sure my content is consistent…",problem,Instagram,"""ig algorithm""",1630321385,The dreaded IG algorithm and reels,2021-08-30 11:03:05,problem,"sensemaking, problem ",problem
112,"Hello there,

I am an expert in Instagram growth and managing. I have been doing this for almost 6 years and managed/grew over 300 pages for myself and for my clients. If you want me to manage and grow your companys or your personal or your niche page, just let me know. Its affordable or if you tell me your budget, I can also make an affordable plan for you. My plan is pretty simple yet powerful. I have grown so many pages for myself and for my clients, so now it's safe to say, I know the majority of the Instagrams ins and outs and have good knowledge about Instagram algorithm.

Pricing: Depending on the niche and the workload.

DM me for further information, if you are interested. Thanks!",ad,InstagramMarketing,"""instagram algorithm""",1630061698,Let Me Help You To Manage &amp; Grow Your Instagram Account.,2021-08-27 10:54:58,"sensemaking, ads",ads ,ads.
114,"Starting  2:43  I talk about how the Instagram explore page works and why it results in giving exposure to accounts that steal content rather than the artists.

 Basically it is because instagram is more likely to show you on the explore page if you have had a lot of interactions in the ""past few weeks"". The most important part of this is that they sum the interactions as opposed to averaging. This leads to a value of quantity over quality and its much easier to have high quantity by stealing. I also talk how instagram gets the specific pool of posts to show you and other factors ranking this pool! 

Youtube video: [https://youtu.be/YvRz5wD7-Yo](https://youtu.be/YvRz5wD7-Yo)

[YouTube Video Thumbnail](https://preview.redd.it/agklovz22pj71.png?width=1280&amp;format=png&amp;auto=webp&amp;s=886fe492e8b5f30635ffa831addb93ece069da8a)","ad, sensemaking",Instagram,"""instagram algorithm""",1629980333,Explaining the Flaw in the Instagram Algorithm,2021-08-26 12:18:53,sensemaking,sensemaking ,sensemaking
20,"I've had my Instagram account for \~3 years and I have only posted two times.  I last posted 15 months ago.  My peak follower count was \~220.  Currently it is 110.  I am following \~90.  My explore page is consistent with the posts &amp; accounts I interact with, so I'm not sure if my account is actually ""dead"".  I have gotten blocked by a handful of accounts a while back when I was trolling people, but I never been banned or received a ban warning from Instagram.  Is it worth trying to revive my IG account, or is it better to start a brand new account?

What else about the IG algorithm should I know when trying to grow my account?  Should I label my account as a creator or business account?  Are posts, stories, or reels better?  How often should I post?  When is the best day/time to post?

Edit:  I forgot to mention I'm using my account for personal use.  Not meant as a business account.",problem,Instagram,"""ig algorithm""",1629599158,"What should I know before I attempt to grow my ""dead"" IG account?",2021-08-22 2:25:58,problem,"sensemaking, problem ",problem
118,"Hello Guys,

I am an expert in Instagram growth and managing. I have been doing this for almost 6 years and managed/grew over 300 pages for myself and for my clients. If you want me to manage and grow your companys or your personal or your niche page, just let me know. Its affordable or if you tell me your budget, I can also make an affordable plan for you. My plan is pretty simple yet powerful. I have grown so many pages for myself and for my clients, so now it's safe to say, I know the majority of the Instagrams ins and outs and have good knowledge about Instagram algorithm.

Pricing: $150-$300/Month depending on the niche and the workload.

DM me for further information, if you are interested. Thanks!!!","ad, sensemaking",InstagramMarketing,"""instagram algorithm""",1629487530,I Will Help You To Manage &amp; Grow Your Business Instagram Account.,2021-08-20 19:25:30,sensemaking,ads ,ads.
121,"Hello Guys,

I am an expert in Instagram growth and managing. I have been doing this for almost 6 years and managed/grew over 300 pages for myself and for my clients. If you want me to manage and grow your companys or your personal or your niche page, just let me know. Its affordable or if you tell me your budget, I can also make an affordable plan for you. My plan is pretty simple yet powerful. I have grown so many pages for myself and for my clients, so now it's safe to say, I know the majority of the Instagrams ins and outs and have good knowledge about Instagram algorithm.

DM me for further information, if you are interested. Thanks!","ad, sensemaking",InstagramMarketing,"""instagram algorithm""",1629399657,I Will Help You To Mnagae &amp; Grow Your Business Instagram Account.,2021-08-19 19:00:57,sensemaking,sensemaking,"sensemaking, ads"
