N,Post,Label..Yim,Subreddit,Keyword,Date_UTC,Title,Date,Label...Dev,Label...Joseph,Label...Xiaobing
183,"Hey, I have an art account on Instagram with 16k followers (@gasaigabe) and in the last week I have noticed a terrible drop in my reach. And to my surprise many other artists were having the same problem. From small 1k accounts to large 100k accounts. A friend of mine who has 100k followers said her reach used to be great, but in the last few weeks only 1% of people who didn't follow her saw the post. Then I saw a post about how Instagram changed its algorithm and will start to prioritize sketches, doodles and comics over the complete drawings. Ironically, the only post in my feed that seems to have a legal reach is an sketch I made of kaguya-sama that reach 8k on #. The other posts are only reaching 1k, when they reach almost nothing.
If this situation is true, I will give up on Instagram completely, because if it was already difficult to grow there, now it seems impossible. Does anyone know something?",,Instagram,"""instagram algorithm""",1597050967,Artists having a reach problem with the new Instagram algorithm.,2020-08-10 9:16:07,,,
184,[removed],,Instagram,"""instagram algorithm""",1596946179,Is it the Instagram algorithm? Or is it the content?,2020-08-09 4:09:39,,,
186,"i’m only trying this stupid new feature because i hear the engagement on them is great, which my constantly shadowbanned account desperately needs. when i upload the reel i choose the “show on feed” option so my followers will see the reel, but the reel doesn’t show up on my feed regardless. the instagram algorithm is already against me so i need my followers to see the reel to give it any chance of hitting the explore page. i’ve tried multiple times and the reel always leaves my feed after showing up for only the first second after i upload. also do hashtags work with reels ? can i put them in the comments and expect them to get me views ?",problem,Instagram,"""instagram algorithm""",1596847172,reels not showing up on feed?,2020-08-08 0:39:32,problem,problem,problem
35,"So now, barely anyone that is following you will see your posts.
You need to tell your followers that there's an arrow they need to click, and then click notification, and turn on posts...and stories and igtv if they want.

This is a joke.
And now they brought reels...wanna be tik tok?.. UGH.",,Instagram,"""ig algorithm""",1596665095,IG algorithm changed..AGAIN.,2020-08-05 22:04:55,,,
37,"Greetings all! 

Today, I'd like to share with you all my (frustrating) experience in building a social media following. I write to you about this cause I dont see all that many posts about one's experience in this and I thought this might be useful for aspiring artists - learn from my mistakes.

I started posting digital art under the name ""Haltab"" in 2017 on DeviantArt. I'd say that skill-wise, I am mediocre. However, I think I am good enough to consistently attract new followers (at least in theory). In other words, I'm not good enough to be called ""good"" by myself or anyone who knows alot about digital art, but good enough to attract followers on social media. Y'know - mediocre. 

Because of this, I assumed that gaining a following would be a breeze. 

It was not. 

DeviantArt has had a rough couple of years, mainly due to the DA team not being able to keep up with other social media. It wasnt until 2019 that they updated their UI to something resembling ""post-2003 internet"". Back in the early 2000's, DA was THE place for artists online. However, they've been dethroned pretty harshly in the recent decades and the masses have to a large extend left the site for Instagram, Facebook, Tumblr (before 18+ content was nuked), ArtStation, etc. So when I joined DA in 2017, it was diffucult to grow, let alone being seen by more than 5 people at all. 

(DA might still be able to recover, now with their new UI, but that all depends on if the DA team cares enough about their site to actually market it and attract the masses .... but I digress) 

In short, my experience trying to grow an audience on DA is a huge disappointment and a massive waste of time. I think, after 3 years, I have maybe 50-100 legitimate followers (if you visit my DA profile, you will see over 1 000 followers, but most of those are just bots that came from a scam service on DA - ironically popular service actually). DA is not a dead site, but it is certainly struggling. And as a result, any artist that will establish themselves on the site in 2020 or later, will probably struggle aswell. The few artists that are doing well on DA are those with a huge pre-built following, or those creating porn. It's quite sad.

I've tried other social media sites aswell, namely Tumblr, ArtStation and Imgur. Tumblr didn't work out because, well, A) because I didnt like the political-echo-chamber-culture on Tumblr, and B) everyone left when the porn was banned. And when it comes to ArtStation, well - I'm not good enough to compete with the artists on ArtStation. ArtStation is very much a site dedicated to the 1% best illustrators, modelers, designers out there. The guys that work for Riot, ILM, etc., are the guys you find on ArtStation. On Imgur I rarely got past user-sub (user-submitted / new posts). In usersub there are people who seemingly dedicate their lives to downvoting everything. I dont even know, man :P

I tried my hand at TikTok. In my early days on TikTok (december 2019) I tried posting my art. Luke-warm response at best. 900 followers over a 3-month period. Then I tried a special kind of russia meme (for the hell of it) like those made by the TikTok user Juccy2 (If i recall correctly), and I blew up. Multiple videos with many millions of views. And mind you, all I did was creating the exact same russia meme over and over again, just with different pop culture characters. People ate it up. Ended up with 91k followers in a couple weeks. I thought I'd take advantage of my TikTok fame and channel it into my art. I deleted all videos, and started posting art videos of a much higher quality than both my original art videos and my russia memes. The response to these new videos were not millions of views. No, barely a couple hundred. At the time of writing this, most of them have around 300 views each. These new videos are the ones you can still see on my TikTok. They're by far the best-quality TikToks I've ever made, but also the least popular. I didnt gain any followers, I merely lost a couple thousand. People didnt want art, they want russia memes. ...Even if its the same god damn joke over and over and over and over again. 

So that brings us to the main dish of this post, and what I really wanted to talk about; Instagram. More specifically, being an unknown artist on Instagram, and having to deal with the Instagram algorithm. 

My first post on IG was in april 2018, and today I have 46 posts (each post being a finished artwork), and 2600 followers. Dont get excited by those two thousand, tho. Most of those followers do not come from people organically finding my artwork on IG, they mainly come from 400 dollars worth of IG ads, personal friends and family, and people coming from my TikTok expecting me to post russia memes. No, I'm not joking.

I joined IG in 2018. I joined late. I joined IG when all the big artists were established and already had tens of thousands of followers. I joined IG when you need to get 3 000+ likes on a post within the first hour of you posting it, in order for the IG algorithm to deem your post worthy enough to be placed at the top of an art-related hashtag. I joined IG when you can only grow by already having a huge amount of followers who will like your post fast enough to have it reach the explore page and thus gain the ability to be seen by potential new followers. I joined IG when people's feeds are bombarded with multi-million-follower-meme-accounts that post multiple meme-posts per hour, every hour, every day, all year long.

I joined IG when the IG-artist-market had entered in it's own version of late stage capitalism.

When asked about how to grow on IG, people say things like ""Post every day"" but also things like ""You need to make sure that you only post high quality posts, and that you have an aesthetically pleasing IG feed"". When I hear things like this, I think ""Well okay then, which is it? Quantity or quality?"" I personally decided on quality (as best as I can manage). Each one of my IG posts represents one finished artwork. It's the best solution in my opinion. However, its pretty hard to ""post every day"" when each painting takes around 12-20 hours of work and you are a full-time student, have a social life, and responsibilities. 

I'll be completely honest here; If you went up to me and asked me ""Haltab, with your three years of experience, how do I grow a social media following for my art in 2020?"" - I honestly wouldnt know what to tell you. I'd probably say ""Either already be a famous person and take your preexisting audience to IG, or make soft-core porn of pop culture characters, or pray to all the seven circles of Hell that you somehow go viral"".

Because honest to God, I have no clue how to grow a following within the current social media market. 

Here's a tangent for you that should paint a picture. I once saw a YouTube video from one of these social media marketing gurus titled ""How to get 10 000 followers in 5 hours"" or something like that. I dont remember the specifics.. but anyways. In the video, the person set up a new IG account, found a niche (skateboarding, I think) and posted 3 posts of people skateboarding. THEN, HE LEGIT OPENED UP A SEPARATE ACCOUNT HE OWNED, WITH 2 MILLION FOLLOWERS, and made a bunch of posts on that account that were all designed to make his 2 million followers follow this new skating account. Then he waited for 5 hours, showed off his results - 10k followers, and ended the video. Yep.

\---

A counter-arguement to my frustration that I've thought about is ""Oh, little Haltab, the reason you dont grow is not because of IG late stage capitalism, it's just because you fucking suck at art"". And I honestly think that this is atleast partially true. However, I also cant shake the feeling that there are other factors at play aswell. For example, I constantly see less experienced artists gain much more attention on social media than I ever do, and I wonder if there is something they're doing better than me other than raw rendering skill. Likewise I often see artists who are WAAAAAAY better than me get less attention than even I do. Off the top of my head I can name two examples right now - OliverBeck (on DA) and MazertYoung (on DA). These guys are criminally underrated! Their art is absolutely stunning, yet they get very little attention. ...Why?

(Side note, check out MazertYoung's Genji fan art - it is literally the coolest Genji fan art I've ever seen). 

So to sum all this up, I guess I should say that I know very little. I know what not to do? I guess...? Or? Honestly, I dont know. At the very least this post should be a fun little read into my disappointing social media growth lol.

TL;DR - I suck at social media :P",problem,ArtistLounge,"""ig algorithm""",1596490163,My 3-year experience building a social media following for my art; a rant.,2020-08-03 21:29:23,problem,sensemaking,sensemaking
191,"Greetings all! 

Today, I'd like to share with you all my (frustrating) experience in building a social media following. I write to you about this cause I dont see all that many posts about one's experience in this and I thought this might be useful for aspiring artists - learn from my mistakes.

I started posting digital art under the name ""Haltab"" in 2017 on DeviantArt. I'd say that skill-wise, I am mediocre. However, I think I am good enough to consistently attract new followers (at least in theory). In other words, I'm not good enough to be called ""good"" by myself or anyone who knows alot about digital art, but good enough to attract followers on social media. Y'know - mediocre. 

Because of this, I assumed that gaining a following would be a breeze. 

It was not. 

DeviantArt has had a rough couple of years, mainly due to the DA team not being able to keep up with other social media. It wasnt until 2019 that they updated their UI to something resembling ""post-2003 internet"". Back in the early 2000's, DA was THE place for artists online. However, they've been dethroned pretty harshly in the recent decades and the masses have to a large extend left the site for Instagram, Facebook, Tumblr (before 18+ content was nuked), ArtStation, etc. So when I joined DA in 2017, it was diffucult to grow, let alone being seen by more than 5 people at all. 

(DA might still be able to recover, now with their new UI, but that all depends on if the DA team cares enough about their site to actually market it and attract the masses .... but I digress) 

In short, my experience trying to grow an audience on DA is a huge disappointment and a massive waste of time. I think, after 3 years, I have maybe 50-100 legitimate followers (if you visit my DA profile, you will see over 1 000 followers, but most of those are just bots that came from a scam service on DA - ironically popular service actually). DA is not a dead site, but it is certainly struggling. And as a result, any artist that will establish themselves on the site in 2020 or later, will probably struggle aswell. The few artists that are doing well on DA are those with a huge pre-built following, or those creating porn. It's quite sad.

I've tried other social media sites aswell, namely Tumblr, ArtStation and Imgur. Tumblr didn't work out because, well, A) because I didnt like the political-echo-chamber-culture on Tumblr, and B) everyone left when the porn was banned. And when it comes to ArtStation, well - I'm not good enough to compete with the artists on ArtStation. ArtStation is very much a site dedicated to the 1% best illustrators, modelers, designers out there. The guys that work for Riot, ILM, etc., are the guys you find on ArtStation. On Imgur I rarely got past user-sub (user-submitted / new posts). In usersub there are people who seemingly dedicate their lives to downvoting everything. I dont even know, man :P

I tried my hand at TikTok. In my early days on TikTok (december 2019) I tried posting my art. Luke-warm response at best. 900 followers over a 3-month period. Then I tried a special kind of russia meme (for the hell of it) like those made by the TikTok user Juccy2 (If i recall correctly), and I blew up. Multiple videos with many millions of views. And mind you, all I did was creating the exact same russia meme over and over again, just with different pop culture characters. People ate it up. Ended up with 91k followers in a couple weeks. I thought I'd take advantage of my TikTok fame and channel it into my art. I deleted all videos, and started posting art videos of a much higher quality than both my original art videos and my russia memes. The response to these new videos were not millions of views. No, barely a couple hundred. At the time of writing this, most of them have around 300 views each. These new videos are the ones you can still see on my TikTok. They're by far the best-quality TikToks I've ever made, but also the least popular. I didnt gain any followers, I merely lost a couple thousand. People didnt want art, they want russia memes. ...Even if its the same god damn joke over and over and over and over again. 

So that brings us to the main dish of this post, and what I really wanted to talk about; Instagram. More specifically, being an unknown artist on Instagram, and having to deal with the Instagram algorithm. 

My first post on IG was in april 2018, and today I have 46 posts (each post being a finished artwork), and 2600 followers. Dont get excited by those two thousand, tho. Most of those followers do not come from people organically finding my artwork on IG, they mainly come from 400 dollars worth of IG ads, personal friends and family, and people coming from my TikTok expecting me to post russia memes. No, I'm not joking.

I joined IG in 2018. I joined late. I joined IG when all the big artists were established and already had tens of thousands of followers. I joined IG when you need to get 3 000+ likes on a post within the first hour of you posting it, in order for the IG algorithm to deem your post worthy enough to be placed at the top of an art-related hashtag. I joined IG when you can only grow by already having a huge amount of followers who will like your post fast enough to have it reach the explore page and thus gain the ability to be seen by potential new followers. I joined IG when people's feeds are bombarded with multi-million-follower-meme-accounts that post multiple meme-posts per hour, every hour, every day, all year long.

I joined IG when the IG-artist-market had entered in it's own version of late stage capitalism.

When asked about how to grow on IG, people say things like ""Post every day"" but also things like ""You need to make sure that you only post high quality posts, and that you have an aesthetically pleasing IG feed"". When I hear things like this, I think ""Well okay then, which is it? Quantity or quality?"" I personally decided on quality (as best as I can manage). Each one of my IG posts represents one finished artwork. It's the best solution in my opinion. However, its pretty hard to ""post every day"" when each painting takes around 12-20 hours of work and you are a full-time student, have a social life, and responsibilities. 

I'll be completely honest here; If you went up to me and asked me ""Haltab, with your three years of experience, how do I grow a social media following for my art in 2020?"" - I honestly wouldnt know what to tell you. I'd probably say ""Either already be a famous person and take your preexisting audience to IG, or make soft-core porn of pop culture characters, or pray to all the seven circles of Hell that you somehow go viral"".

Because honest to God, I have no clue how to grow a following within the current social media market. 

Here's a tangent for you that should paint a picture. I once saw a YouTube video from one of these social media marketing gurus titled ""How to get 10 000 followers in 5 hours"" or something like that. I dont remember the specifics.. but anyways. In the video, the person set up a new IG account, found a niche (skateboarding, I think) and posted 3 posts of people skateboarding. THEN, HE LEGIT OPENED UP A SEPARATE ACCOUNT HE OWNED, WITH 2 MILLION FOLLOWERS, and made a bunch of posts on that account that were all designed to make his 2 million followers follow this new skating account. Then he waited for 5 hours, showed off his results - 10k followers, and ended the video. Yep.

\---

A counter-arguement to my frustration that I've thought about is ""Oh, little Haltab, the reason you dont grow is not because of IG late stage capitalism, it's just because you fucking suck at art"". And I honestly think that this is atleast partially true. However, I also cant shake the feeling that there are other factors at play aswell. For example, I constantly see less experienced artists gain much more attention on social media than I ever do, and I wonder if there is something they're doing better than me other than raw rendering skill. Likewise I often see artists who are WAAAAAAY better than me get less attention than even I do. Off the top of my head I can name two examples right now - OliverBeck (on DA) and MazertYoung (on DA). These guys are criminally underrated! Their art is absolutely stunning, yet they get very little attention. ...Why?

(Side note, check out MazertYoung's Genji fan art - it is literally the coolest Genji fan art I've ever seen). 

So to sum all this up, I guess I should say that I know very little. I know what not to do? I guess...? Or? Honestly, I dont know. At the very least this post should be a fun little read into my disappointing social media growth lol.

TL;DR - I suck at social media :P",,ArtistLounge,"""instagram algorithm""",1596490163,My 3-year experience building a social media following for my art; a rant.,2020-08-03 21:29:23,,,
39,"Will create a pod of 15 people.

1. The drop time is 9PM (21:00) EDT. 

2. You will be required, within the window of 1 hour (works best with the IG algorithm), to like and leave a meaningful comment on everyone's recent post who dropped their handle at the designated time. As a reminder, I will always kick-off the section at 9PM.

3. The group cannot be used for anything else.

4. It is your responsibility to privately notify me, by sending a screen shot of likes/comments on your recent post, of who is missing from the group.

5. After two consecutive strikes (not liking/commenting) you are removed.  

After two strikes anytime over two weeks, you are removed.

   

&amp;#x200B;

 DM your handle if interested.","sensemaking, ad",IGPods,"""ig algorithm""",1596141885,Tiger Pod for Writers/Poets,2020-07-30 20:44:45,sensemaking,sensemaking,sensemaking
194,"Hi All,

I run a music/art Instagram page where I promote submissions and just stuff that I think is cool and other people will appreciate. The page was relatively successful amassing 16K followers with videos receiving 1000+ views and a large number of likes.  

However, over the last couple of months, my reach has fallen drastically, and I'll be lucky if I even get 100 views on my videos. I had stopped posting for a while, and my followers have fallen to 13K, but I decided to reboot the Instagram account and have been working over the last month to curate photos and videos and have 100 posts ready for the next 100 days.  However, when I look at my recent posts, my insights my videos barely reach 300+ people (Barely 2% of my total following), and this is very frustrating.

**I tried the following things.** 

1. Going in a new direction and started adding photography to my Instagram -  this seems to have some improvements but hasn't done much.
2. Liking and commenting on more users works to show that I am active to the Instagram algorithm.
3. Started maintaining a red theme throughout my posts so that it looks more attractive on the main profile page.
4. Removed all banned hashtags from my previous posts 

**I'm thinking of doing the following things.**

1. Remove my **mass followers** \- that is my followers that follow more than 5000 people as it is unlikely that my posts will reach them, however, doing so will remove 7,000 of my followers bringing me down to 6,000 followers.
2. Starting a completely new Instagram account as I have previously used programs such as followliker but soon stopped that once I thought it was actually detrimental to pursue such a strategy. Perhaps doing so permanently flagged my account to Instagram as spam?

*It takes a lot of work to curate the photos and music, and I honestly am starting to think that It might not be worth it anymore and am seriously considering deleting the page altogether.*

Any feedback would be greatly appreciated! here's a link to my Instagram page that I am referring to.***\[rubyroom.label\]***

Thanks in advance for your help!",problem,Instagram,"""instagram algorithm""",1596015141,So frustrated with reach - thinking of deleting my Instagram completely.,2020-07-29 9:32:21,problem,"sensemaking, problem ",sensemaking
32,[removed],,socialmedia,"""Instagram's algorithm""",1595378567,Changes in Instagram's Algorithm?,2020-07-22 0:42:47,,,
200,[removed],,socialmedia,"""instagram algorithm""",1595378445,Changes in Instagram Algorithm?,2020-07-22 0:40:45,,,
40,"I used to be on IG a bit over a year ago (I had like 600 followers so not too big of a deal) in 3 different accounts. One of them is my photography account where I mostly posted skimpy female portraits.

Now I want to come back to IG and chamge the handle to that account in order to start a branding process. I will post the same kind of content. 

I was shadowbanned (my puctures did not appear in tag search), I used to compulsively like recent pictures to get more exposure, etc so I did many things wrong. 

Questions:
- Should I change the handle or start a new account?
- If I do restart, is posting the good pictures from the past going to hurt me via the ig algorithm?
- Will linking the new account to the same phone as the old ones hurt me?",problem,Instagram,"""ig algorithm""",1595352905,Should I start over?,2020-07-21 17:35:05,problem,problem,problem
201,"I’m in the process of trying to organically grow an Instagram account that focuses on News from the gaming Industry. I understand that the Instagram algorithm focuses heavily on engagement, and that there are best practices to use when posting (consistent content schedule, high quality content, interesting topics, using different mediums, popular and less popular hashtags, comments, tagging etc.), and although we are seeing some growth, I don’t quite understand how follower conversions are so low. 

For example, we’ve had a post go viral (relative to our size of course) and it has got 2000+ reach, 100+ shares 300+ likes in the last 20 hours. From that, we’ve received 1 follower.

Does anybody have any explanations or case studies as to why this is? Are there some tips that I’m missing that optimizes for follower conversions? 

Any help is greatly appreciated. Thanks","sensemaking, problem",SocialMediaMarketing,"""instagram algorithm""",1595341606,Instagram content Reach to Followers Conversion Question!,2020-07-21 14:26:46,"sensemaking, problem","sensemaking, problem","sensemaking, problem"
