N,Post,Label..Yim,Subreddit,Keyword,Date_UTC,Title,Date,Label...Dev,Label...Joseph,Label...Xiaobing
83,"It’s my belief that when it comes to blogging for business – content is king – Including social media &amp; Instagram content. 

It’s no surprise that visual content is 40 times more likely to get shared on social media than other types of content. That’s why social media platforms such as Instagram, Pinterest and Snapchat continue to grow in popularity. They are visual, and have a unique way of delivering a complex message all within a few seconds.

Lately, we’ve been specifically obsessed with Instagram. So, to help you get ready for creating your Instagram content, I’ve got an ultimate guide that covers exactly how to create content for your Instagram account and where you can find them and how to editing.

**Why quality Instagram content is so important?**

The reality is that people usually don’t see all the new posts when they visit Instagram. [A study by Instagram](http://blog.instagram.com/post/145322772067/160602-news) themselves found that before the algorithm, on average, **users missed 70 percent of the posts on their feeds** and 50 percent of the posts from their friends.

Let’s talk about the Instagram algorithm. The Explore tab uses an algorithm to surface content based on the user’s interests and past behaviors.

As long as you are creating engaging, relevant, and timely content, the algorithm is actually an advantage to you. It is a brilliant way for your great content to reach more people and it puts you and your posts in a better position and in front of new audiences.

# Creating Instagram Content

Before you start, you should ask yourself these two questions:

Firstly, what type of content aligns with your brand? And what does your audience want to see?

Being able to pinpoint the who, what and why about your Instagram brand is a really important step for planning out your content. If you know what your brand is about, and what kind of content your audience likes to engage in, you’ll really be able to hone in, and create the right type of content from the start.

Finding your brand niche and really dedicating your efforts to just that niche will pay off. A lot of Instagram accounts get sidetracked with posting content outside of their target audience and niche, and that could be slowing down your growth.

***What type of Instagram content should we post?***

There are plenty of ways to create an engaging feed with a cool aesthetic– even if you’re selling something as unglamorous or promoting an entirely digital product that seems impossible to visualize.

For the first let me tell you 7 tips that you should consider when you creating posts and here are some ideas for you.

Let’s Dive in:

**1. Templates:**

Thankfully, these days there are loads of great websites that offer pre-designed templates you can tweak to fit your needs with minimal effort.

Online design tools such as [Canva](https://www.canva.com/), [lucidpress](https://www.lucidpress.com/), [Snappa](https://snappa.com/), and [Stencil](https://getstencil.com/) are the perfect sample for creating engaging content for Instagram posts and story and even other social media posts.

You just need to select one template and you can customize them by adding text overlays, filters, icons, borders…whatever you like. However, you don’t need to do much–in fact, the less you change a template, the better. 

![img](iajvvg92vv931 ""Canva"")

![img](nyxobi92vv931 ""Stencil"")

**2.** **High-quality stock images**

Stock Images can help you create a varied feed when used with a mixture of other images, such as templates.

To find high-quality photos head to [Unsplash](https://unsplash.com/) or [Stocksnap.io](https://stocksnap.io/). They offer a range of images for free, and you’re bound to find something suitable whatever your niche.

If you have a bit of a budget to spend, try [Stocksy](https://www.stocksy.com/). As you would expect for a paid service, the quality of the images is higher, and the variety is wider.

![img](4fq4zwiavv931 ""Stocksy"")

**3. User-generated content** 

(UGC) occurs when a customer organically creates content that is in reference to your brand, product or service. 

User-generated content serves as a powerful customer endorsement that can encourage prospects to consider your brand more seriously. Additionally, user-generated content provides Instagram marketers with creative new content to re-share via your account.

Get around this by running a competition where users can win something by creating an Instagram post and tagging it with your own brand hashtag, or a campaign hashtag.

Offering followers a free product or a discount, for example, will help you build momentum for your campaign as more users are likely to use your hashtag.

Keep in mind that you shouldn’t be too restrictive with the type of content you ask your users to post, otherwise they aren’t going to bother!

&amp;#x200B;

**4. Shooting Photos**

One thing you’re going to need to create Instagram content is a camera. But if a fancy DSLR camera and all the accessories that come with it aren’t in your budget, don’t worry.

What’s more important is the content and composition of your photos but always plan what your photos are going to look like.

Start thinking about the angles the photo will be taken from, your position in relation to the camera, the lighting, and composition.

One tip that you should try out on your next shoot is to take as many photos as possible. Think about changing the composition, your distance from the camera, your pose, having a close-up, or changing the angle from where the photo is taken. Not only will this mean you’ll be able to pick the best from the bunch to post to Instagram, but you’ll also have more content for the future.

&amp;#x200B;

**5. Contest &amp; Giveaways**

One way for Businesses to gain more audience on Instagram is to run promotional campaigns with Hashtags or photo contests asking your audience to share images relevant to your brand.

Contests and giveaways posts will naturally receive more engagement than normal as there’s an incentive to like and comment, and your audience will tag their friends thereby increasing the reach of your post (and a contest!). 

To pull off a successful Instagram contest, make sure you have an appropriate prize ready, provide clear steps to enter for participants, set a deadline and decide how you’ll select the winner! 

&amp;#x200B;

**6. Behind the Scene**

People like to do business with people, not brands.

That’s why it’s more important than ever to create a human connection with your customers. Showing them glimpses of your staff, and the things that go on behind-the-scenes is a one really effective way of doing so.

It creates transparency that allows followers to feel like they’re getting to know the “real you” behind the brand. This builds trust, and it’s a refreshing change of pace after a stream of product images.

Another Bonus is that behind the scenes content doesn’t need to be nearly as polished as some of your other images. Because of this, some brands (including [Allbirds](https://www.allbirds.com/), pictured below) prefer to keep their behind-the-scenes content exclusively to their Stories.

&amp;#x200B;

**7. Storytelling**

Creating a story with your product engages consumers and creates a compelling reason for them to click on your site and start shopping.

This strategy works for pretty much any product category.

A powerful way to tell your brand story is using the 5 W’s to come up with content ideas: who, what, when, where, and why?

*  Who: Who has been the biggest supporter of your business? Who inspires you? Who do you work with? Who do you serve? 
*  What: What have been some obstacles that you have overcome? What are you reading or listening to? What are your recent wins? 
*  When: When do you do your best work? When do you celebrate? When do you relax? 
*  Where: Where do you work, dream, think, or recharge? Where do you get inspiration from? 
*  Why: Why did you start your business? Why do you do things a certain way? 

What “W” can you answer right now? Pick one that feels relevant to you today and takes 5 minutes to create a post. 

![img](hgio9xvkvv931)

Another example of storytelling is showcasing yourself at work or your company’s employees in action is great for putting a human face on your brand, which makes what you share on Instagram more interesting to your followers. 

 *Here are some post Ideas to spice up your feed:* 

* **Product Posts:** Pictures and videos of your products will likely be one of the easiest (and most expected) places to start on Instagram. Sharing content featuring your products in all their glory will, of course, help you drive sales and promote your business on Instagram. 
* **Product Launches:** Instagram provides a great platform for launching new products or upgrades but simply adding a photo of your product can be a bit ho-hum when it comes to your Instagram posts. Create something that stands out and makes us stop and look further. You can provide more context in your description after grabbing attention with a great image. 
* **Offers and Promotions:** If you have a promotion or sale, don’t forget to share it on Instagram.  The more creative and visual you can make it the better.  If you have over 10,000 followers or a verified account you can also add “Swipe Up” links on Instagram Stories to encourage followers to swipe/click through to your content. 
* **Events, Holiday and Seasonal posts:** Take advantage of this by creating seasonal posts that are timely and immediately relevant. Posts about summer vacations, winter weather, and even a specific meteor shower can work in addition to the obvious holidays, too. Or you can post content from before, during, and after the event to create more hype. This can be an event that your business is hosting, or one that you’ve been invited to attend. 
* **Quotes &amp; Memes:** Regardless of industry and audience, a quote or meme is a great way to convey information and emotion to your followers and boost engagement. The possibilities are endless with text posts! They could be humorous, informative, emotive, or simply some nice looking typography, and the best part is that any brand can use this Instagram post idea and make it relevant to their audience. 
* **Provide Video Tutorials:** Video tutorials have the distinct advantage of being immediately valuable and actionable to your target audience. Even a thirty second video showing them how to use, care for, or set up your product will go a long way and if you can show how easy your products are to use or how valuable they are, you might be able to make some sales too. 
* **Stats and Numbers:** Stats and number can be used to tell a story too. The key is to make it visual and engaging. No need to say that just use statistics and numbers that relevant to your niche to satisfying your followers. 
* **Other Users Posts:** When you find a post you want to share with your followers, simply send a DM to the user or comment on the photo to let them know you a) love their Instagram content and that you think your users will enjoy it too, and b) to ask for permission to share it to your feed. 
* **Thought Leadership:** Ask yourself how can you help your followers or audience with what you know and your thoughts, ideas, and predictions on a particular topic? Don’t be afraid to share it in a visual way with images or video – or even via Instagram Stories. 
* **Questions and Answers:** Answering customer questions on Instagram will encourage more people to follow you (especially if there’s a chance for you to answer their own questions). You can have Q&amp;As written out in a text-based image, having one question and answer to a post. Remember that the character limit for captions is 2,200 characters, so you can actually squeeze quite a bit of writing into your post, if you want to. Instagram even released a Questions Sticker that you can use to solicit answers from your audience and share your response as a photo or video. 
* **Link to Blog Content:** Instagram is not about getting people to link away from Instagram as it is for other platforms. However, you might want to lead them to your website, blog content or podcast. Make sure your image or video are engaging and be sure to add some helpful information in your caption.

![img](bqkrpvhovv931)

![img](s3gefursvv931)

# Editing Your Instagram Content

If you look at some of the most successful accounts on Instagram, you’ll notice they all have one thing in common, regardless of what industry they’re in. They all have a strong Instagram aesthetic that they stick to!

To captivate your Instagram followers, you’ll need to make sure your photos and videos are edited properly. That doesn’t mean you have to hire a professional editor.

There are plenty of apps available that are really easy for anyone to use. Lots of these are free of charge or only cost a couple of dollars, so they are worth a try.

Everyone with an Instagram account has access to the same filters and editing tools.

Editing your photos with another app can separate your pictures from the crowd. All of these apps are unique and offer different features depending on what you’re looking for, such as collages, text overlays, face touch-ups, or vintage themes.

&amp;#x200B;

Here is a list of some best apps: 

&amp;#x200B;

**1.** **Afterlight** ([Windows](https://www.microsoft.com/en-us/p/afterlight/9wzdncrdbq44) , [iOS](https://apps.apple.com/us/app/afterlight-2/id1293122457) , [Android](https://play.google.com/store/apps/details?id=com.fueled.afterlight&amp;hl=en_US))

The only paid app on this list, Afterlight definitely earns its keep. The quality and simplicity of the app make it a joy to use and the functionality is also second to none. 

Afterlight comes built-in with all the standard editing tools you’d expect from a high caliber app; Saturation, Contrast, Exposure, and even RBG Shadow tones can be adjusted, but that’s not all.

They also have some really cool effects and designs that allow you to add text and other typography to your images:

You can even put part of your text behind elements within your photo. This feature is perfect for businesses. 

&amp;#x200B;

**2. Snapseed** ([iOS](https://apps.apple.com/us/app/snapseed/id439438619) , [Android](https://play.google.com/store/apps/details?id=com.niksoftware.snapseed&amp;hl=en_US))

Snapseed takes your editing effects to a whole new level. You can apply effects and filters to specific areas of your image with high precision:

If you manage to get a decent shot on your camera and need to do some minimal editing work, Snapseed will do it for you in the least amount of time.

They’ve got a really cool editing feature called a perspective tool. This helps you automatically adjust or correct any skewed lines in your images.

Let’s face it, a picture taken by hand won’t be 100% perfect. You might think your horizon is level or buildings are lined up properly, but that’s rarely the case.

That’s when the perspective tool can make your photos look professional.

What’s the best part about Snapseed? It’s free. 

  

**3.** **VSCO** ([iOS](https://apps.apple.com/us/app/vsco-photo-video-editor/id588013838) &amp; [Android](https://play.google.com/store/apps/details?id=com.vsco.cam&amp;hl=en_US))

Having VSCO on your smartphone is like carrying a Swiss knife with you. Houses all the tools you’d expect from a favorable photo editing app; saturation, highlights, temperature, and vignette can all be adjusted alongside many other settings. 

VSCO also offers a built-in camera with advanced controls, allowing you to capture the perfect shot, edit and save, all without leaving the app. 

Filters are also a huge feature for VSCO, with the option to buy filter packs each with their own distinctive styles and tones, very popular amongst users of the app.

Highly recommended for those wanting to evolve their Instagram to the next level. 

  

**4. Adobe Photoshop Lightroom (** [Web-App](https://lightroom.adobe.com/) **,** [iOS](https://apps.apple.com/us/app/adobe-lightroom/id878783582) **,** [Android](https://play.google.com/store/apps/details?id=com.adobe.lrmobile&amp;hl=en_US) **,** [Lightroom Classic](https://www.adobe.com/products/photoshop-lightroom-classic.html)**)**

This entry on the list is probably more suited to those who have a real passion for photography and want an editing app that provides advanced editing functionality on the go. 

The app comes stacked with tons of tools giving you the ability to change almost every single detail in an image, and of course, preset filters are readily available.

Lightroom also houses a built-in camera, with a pro mode that gives you control over settings such as Shutter Speed, White Balance, and ISO.

One of the unique features of Adobe Photoshop Lightroom is the Creative Cloud Photography plan, essentially a monthly subscription with Adobe, providing benefits such as; access your media anywhere, sync photo edits across all devices, Photoshop CC and much more.

The Adobe Photoshop Lightroom app is a must-have for those who take the art of photography seriously, or even for those who want to learn more about photo editing. 

&amp;#x200B;

 \*\*Another great time-saving tip is to edit the content for the week in one sitting. By setting time aside just for editing, not only will it help you see what your final photos for the week will look like, but it helps you be more organized for posting your Instagram Content! 

# Posting Your Instagram Content

&amp;#x200B;

Now that you’ve planned out your content, created it, and edited it, it’s time to post!

But, you need to be strategic about your posting too if you want to build your Instagram account, and make the most of that beautiful aesthetic you’ve just crafted!

When you plan out your content, avoid posting photos that are too similar side by side, or even too close to each other, otherwise, your followers might get tired of seeing the same content over and over again.

One of the easiest ways to plan out your posts is with Post Scheduler Apps. Once you’re happy with the way your future posts look, it’s time to schedule and post!

\- 

\-

To post perfect Instagram photos, you don’t have to be a professional photo editor or photographer. Use these tips and tricks to make your photos look more engaging and captivating.

These tips and ideas are just what you need to get up and running. You don’t need to do them all at once. Start with what you feel most comfortable with and then add on as you gain more and more confidence.

Also, it’s important that marketers work on their Instagram skills and improve them. When posting the perfect picture, try to add interactive, interesting and engaging hashtags.

Ensure to post pictures with engaging captions, which can trigger conversations with your followers. You can ask a question or add a strong call to action. Marketers polishing their Instagram skills will help their brand to grow.

&amp;#x200B;

**What ideas will you try first?  And do you have any of your own to share? Leave them in the comments below.**",sensemaking,Instagram,"""instagram algorithm""",1562942203,((Ultimate Guide to Creating Engaged content for your Business Instagram Page)) Create=&gt;Edit=&gt;Post,2019-07-12 14:36:43,sensemaking,sensemaking ,sensemaking
84,"So I made a new Reddit account seeing as I ain't been on here in a long time and forgot my other account.

&amp;#x200B;

I wanted to make a post to help and discuss about instagram.

&amp;#x200B;

I've grown instagram accounts in the past and sold them. I have recently started fresh once again just to prove that the instagram ""algorithm"" isn't actually a bad thing after all. I mention this because people are blaming the algorithm for their stunt in growth on instagram or the reason it's impossible to grow. I believe both statements are not true..

&amp;#x200B;

Most people don't know how to grow their accounts, manage them or even monetise. A lot of people also ain't motivated enough so they give up and say it doesn't work.

&amp;#x200B;

I have within the last month created a niche account, grew it from 0 to just under 400 followers, I generally get on a video between 500 to 7,000 views. And the page can usually pull in anywhere between 5 to 20 followers per post which is good growth for a fairly new account. Oh and I forgot to mention I did this completely free, I never paid for shoutouts etc.. I also did not leverage any of my other accounts to do this.

&amp;#x200B;

So if anyone has any questions I'll be glad to answer them.",problem,InstagramMarketing,"""instagram algorithm""",1562843430,I grow accounts &amp; help clients!,2019-07-11 11:10:30,sensemaking,sensemaking,sensemaking
8,,,Instagram,"""ig algorithm""",1562737058,"I hear people talk trash on the IG algorithm all the time, but lately it seems to be in my favor. Is anyone else with a smaller account experiencing an increase in engagement? It’s very out of no where.",2019-07-10 5:37:38,,,
9,"I can’t explain myself how some days I reach tons of people and manage to do a lot of likes and some days I can’t even get to 200. I don’t do anything different, I don’t f/Unfollow people, I don’t use engagement pods and still Instagram punish me in some ways. Why is that?",,Instagram,"""ig algorithm""",1562616904,IG algorithm is pretty messed up?,2019-07-08 20:15:04,,,
90,,,Instagram,"""instagram algorithm""",1562168526,"Instagram Bug - Instagram algorithm can seemingly detect WHAT is in your photo, and likely reacts to it accordingly",2019-07-03 15:42:06,,,
0,"even for my test accounts, 20 follow per day got action blocked!

is this the new IG algo?

what's next!",problem,Instagram,"""IG algo""",1562161989,did all bots stop working?,2019-07-03 13:53:09,problem,,problem
94,,,Instagram,"""instagram algorithm""",1561489470,5 facts about the Instagram algorithm,2019-06-25 19:04:30,,,
96,"Is anyone else experiencing this?

  
I have an instagram account that specialises in photos of affordable/reliable automatic watches and I have a pretty small following of 5k but I have high engagement and work with several brands. (I have a separate website that reviews watches)

I've noticed something bizarre with my last post, checking the anylasis of the post I only had 4 impressions from Hashtags and around 100 likes, my last 3 posts are still getting regular likes and have over 400 likes, are the top posts on some of the hashtags and are getting around 4-6k impressions from hashtags alone.

I'm not shadownbanned, I've checked with the shadow ban tests as well as having someone who doesn't follow me check if my posts come up on the hashtag feeds which they do.

Not sure if this is a new instagram algorithm change or just some weird error.

My instagram handle is **crownandclasp** if that would help any of you provide some answers.

Thanks guys.",,Instagram,"""instagram algorithm""",1561418521,Hashtag Engagement non existent from what it was- Not Shadownbanned,2019-06-24 23:22:01,,,
97,"Wondering if you guys can help me understand the Instagram algorithm as well what insights impressions exactly mean. Trying to grow my Instagram but first I need to understand how social media works with impressions, clicks, etc. Any website links would be very helpful as well",problem,Instagram,"""instagram algorithm""",1561308198,Trying to understand Instagram algorithm,2019-06-23 16:43:18,problem,problem,problem
100,"For those who like your own post (or others posts for that matter), why do some accounts show up before others? Is it simply profiles that you like or view the most? Or is there more to it?",,Instagram,"""instagram algorithm""",1561130901,How does the Instagram algorithm pick who shows up in the “like” section on your own post?,2019-06-21 15:28:21,,,
103,"In the Context that Instagram Algorithm is becoming stricter Day by Day, I am wondering if anyone is having a recent experience of Growing an Instagram Account using Automation Softwares. How does one stand a chance in 2019 by inheriting the traditional ways like following and unfollowing, hashtag following, reposting top posts for a hashtag, commenting and auto DM to followers, getting into DM Engagement groups, etc. Anyone trying Automation software in 2019 if they could share what has been their recent experience.",problem,socialmedia,"""instagram algorithm""",1560935958,Hello Marketers - Does any one of you achived recent success in Growing an Instagram Account using Automation Softwares like Jarvee or FollowLiker?,2019-06-19 9:19:18,problem,problem,problem
